{
  "manifest_version": "0.1",
  "id": "mfst-00000000-0000-0000-0000-000000000002",
  "artifact_id": "art-00000000-0000-0000-0000-000000000002",
  "artifact_hash": "sha256:db616b8a3982e379b248785c878be9033e54baadc0a49ba73391d967f73efcbe",
  "source": {
    "vendor": "anthropic",
    "kind": "cli",
    "url": "https://claude.ai/code",
    "session_id": "sess-abc123def456"
  },
  "agent": {
    "name": "fusionlayer-daemon",
    "version": "1.2.0",
    "platform": "darwin/arm64",
    "key_id": "key-2026-05-21"
  },
  "captured_at": "2026-05-21T11:00:01Z",
  "consent": {
    "basis": "legitimate_interest",
    "notice_url": "https://fusionlayer.app/privacy",
    "ccpa_category": "inferences"
  },
  "redactions": [
    {
      "pattern_id": "secret:openai-key",
      "count": 1,
      "placeholder": "[REDACTED]"
    }
  ],
  "retention_policy": {
    "delete_after_days": 90,
    "scheduled_delete_at": "2026-08-19T11:00:01Z"
  },
  "prev_manifest_id": "mfst-00000000-0000-0000-0000-000000000001",
  "manifest_signature": "sha256:fd26298d409d93873fbdfa08c8417d2112e504971ffc9cb6e7b50964e2f77f2a"
}
